Name,Position,Description,ImgFileName,Qskill,Wskill,Eskill,QskillName,WskillName,EskillName
레이니크,식공학자,버섯숲 출신의 마녀,rainyk,지정한 적에게 나비를 날려 200의 데미지를 입힌다.,자신의 이동 속도를 5초간 20% 늘린다.,모든 마나를 소모하여 가로축으로 강력함 빔을 말사한다. 소모한 마나 만큼 데미지를 입힌다.,시간을 달리는 나비,나는 마녀로소이다,리첸시아의 파수꾼
믹슈브,마법학자,슈뢰딩거의 이중성의 마녀,mixube,"지정한 방향으로 포크를 날린다. 적중시 표식을 남기며 200의 피해를 입히고, 사거리 내로 재사용시 즉시 적에게 이동한다.",자신의 공격 데미지를 영구적으로 1% 늘린다.,에피타이저의 쿨타임을 초기화 한다. 에피타이저의 재사용 피해를 두배로 늘린다.,에피타이저,메인 디쉬,디저트
세라피나,파티시에,세라피나 더 락,seraphina,와인을 뿌려 200의 피해를 입힌다.,와인을 자신에게 부어 체력을 150 회복한다.,4초동안 영역을 전개하고 이후 주변의 적에게 100의 피해를 입힌다.,다가오지마,여유로운 한잔,전조강림
셀리나,공장주인,아트르빈의 마석을 던지는 하마,selena,지정한 대상에게 마석을 던져 200의 피해를 입힌다.,5초동안 자신에게 200의 보호막을 부여한다.,지정한 방향에 마석을 대량으로 던져서 400의 피해를 입힌다. ,아트르빈식 협상,완벽한 계산,마석 대폭발
티네야,식공학자,홍백과 무표정의 나방,tyneya,스킬에 따라오는 기본 공격은 100의 추가피해를 입힌다. 더불어 데미지의 50% 만큼 회복한다.,자신의 이동속도를 영구적으로 2% 증가시킨다.,체력의 절반을 소모하여 10초동안 평타 데미지를 50% 증가시킨다.,공간을 가르는 나방,이름은 아직 없다,홍백의 마녀
